NCT Number,Study Title,Study URL,Acronym,Study Status,Brief Summary,Study Results,Conditions,Interventions,Primary Outcome Measures,Sponsor,Collaborators,Sex,Age,Phases,Enrollment,Funder Type,Study Type,Other IDs,Start Date,Primary Completion Date,Completion Date,First Posted,Results First Posted,Last Update Posted,Locations
NCT04191135,Study of Olaparib Plus Pembrolizumab Versus Chemotherapy Plus Pembrolizumab After Induction With First-Line Chemotherapy Plus Pembrolizumab in Triple Negative Breast Cancer (TNBC) (MK-7339-009/KEYLYNK-009),https://clinicaltrials.gov/study/NCT04191135,,ACTIVE_NOT_RECRUITING,"The purpose of this study is to compare the efficacy of olaparib (MK-7339) plus pembrolizumab (MK-3475) with chemotherapy plus pembrolizumab after induction with first-line chemotherapy plus pembrolizumab in triple negative breast cancer (TNBC). The primary hypotheses are:

1. Olaparib plus pembrolizumab is superior to chemotherapy plus pembrolizumab with respect to progression-free survival (PFS).
2. Olaparib plus pembrolizumab is superior to chemotherapy plus pembrolizumab with respect to overall survival (OS).

As of Amendment 3, study enrollment was discontinued. Participants who were receiving benefit from the study intervention could continue treatment until criteria for discontinuation are met. Participants who are on study treatment or in follow-up phase will no longer have tumor response assessments by BICR.",YES,Triple Negative Breast Neoplasms,BIOLOGICAL: Pembrolizumab|DRUG: Olaparib|DRUG: Carboplatin|DRUG: Gemcitabine,"Progression-Free Survival (PFS), PFS was defined as the time from randomization to the first documented progressive disease (PD) per Response Evaluation Criteria in Solid Tumors Version 1.1 (RECIST 1.1) as Assessed by Blinded Independent Central Review (BICR), or death due to any cause, whichever occurs first. Per RECIST 1.1, PD was defined as ≥20% increase in the sum of diameters (SOD) of target lesions. In addition to the relative increase of 20%, the sum had to demonstrate an absolute increase of ≥5 mm. The appearance of one or more new lesions was also considered PD. PFS is reported based on the product-limit (Kaplan-Meier) method for censored data., Up to approximately 29 months|Overall Survival (OS), OS was defined as the time from randomization to death due to any cause. Participants without documented death at the time of the final analysis were censored at the date of the last follow-up. OS is reported based on the product-limit (Kaplan-Meier) method for censored data., Up to approximately 29 months",Merck Sharp & Dohme LLC,,ALL,"ADULT, OLDER_ADULT",PHASE2,462,INDUSTRY,INTERVENTIONAL,7339-009|MK-7339-009|KEYLYNK-009|195082|2022-500418-24-00|2019-001892-35,2019-12-19,2022-12-15,2025-11-18,2019-12-09,2024-02-14,2024-11-13,"Pacific Cancer Care ( Site 0142), Monterey, California, 93940, United States|UCSF Helen Diller Family Comprehensive Cancer Center ( Site 0138), San Francisco, California, 94158, United States|John Wayne Cancer Institute ( Site 0111), Santa Monica, California, 90404, United States|St. Joseph Heritage Healthcare ( Site 0104), Santa Rosa, California, 95403, United States|University of Miami Sylvester CC ( Site 0146), Miami, Florida, 33136, United States|Georgia Cancer Center at Augusta University ( Site 0129), Augusta, Georgia, 30912, United States|University of Chicago ( Site 0159), Chicago, Illinois, 60637, United States|Massachusetts General Hospital ( Site 0155), Boston, Massachusetts, 02114, United States|Henry Ford Health System ( Site 0103), Detroit, Michigan, 48202, United States|Virginia Piper Cancer Institute ( Site 0157), Minneapolis, Minnesota, 55407, United States|Memorial Sloan Kettering Cancer Center- Monmouth ( Site 0161), Middletown, New Jersey, 07748, United States|MSKCC-Bergen ( Site 0162), Montvale, New Jersey, 07645, United States|Memorial Sloan-Kettering Cancer Center at Commack ( Site 0160), Commack, New York, 11725, United States|Memorial Sloan-Kettering Cancer Center ( Site 0156), New York, New York, 10065, United States|Mercy Clinic Oncology and Hematology ( Site 0110), Oklahoma City, Oklahoma, 73120, United States|The Center For Cancer And Blood Disorders ( Site 0151), Fort Worth, Texas, 76104, United States|Texas Oncology-New Braunfels ( Site 0168), New Braunfels, Texas, 78130, United States|Texas Oncology-San Antonio Northeast ( Site 0165), San Antonio, Texas, 78217, United States|Texas Oncology-San Antonio Medical Center ( Site 0158), San Antonio, Texas, 78240, United States|Texas Oncology - San Antonio Stone Oak ( Site 0166), San Antonio, Texas, 78258, United States|Renovatio Clinical ( Site 0117), The Woodlands, Texas, 77380, United States|Virginia Oncology Associates ( Site 0163), Newport News, Virginia, 23606, United States|Virginia Oncology Associates ( Site 0153), Norfolk, Virginia, 23502, United States|Virginia Oncology Associates ( Site 0164), Virginia Beach, Virginia, 23456, United States|YVMH dba Virginia Mason Memorial/North Star Lodge Cancer Center ( Site 0128), Yakima, Washington, 98902, United States|Princess Margaret Cancer Centre ( Site 0005), Toronto, Ontario, M5G 2M9, Canada|CSSS de Laval- Hopital de la Cite de la Sante ( Site 0011), Laval, Quebec, H7M 3L9, Canada|Centre Hospitalier de l Universite de Montreal - CHUM ( Site 0003), Montreal, Quebec, H2X 3E4, Canada|Jewish General Hospital ( Site 0010), Montreal, Quebec, H3T 1E2, Canada|McGill University Health Centre ( Site 0002), Montreal, Quebec, H4A 3J1, Canada|Centro Investigación del Cáncer James Lind ( Site 0510), Temuco, Araucania, 4780000, Chile|IC La Serena Research ( Site 0511), La Serena, Coquimbo, 1720430, Chile|Fundacion Arturo Lopez Perez ( Site 0500), Santiago, Region M. De Santiago, 7500921, Chile|Pontificia Universidad Catolica de Chile ( Site 0501), Santiago, Region M. De Santiago, 8330032, Chile|Oncocentro ( Site 0502), Vina del Mar, Valparaiso, 2520598, Chile|Fundacion Colombiana de Cancerologia Clinica Vida ( Site 0601), Medellin, Antioquia, 050030, Colombia|Clinica de la Costa Ltda. ( Site 0600), Barranquilla, Atlantico, 080020, Colombia|Organizacion Clinica Bonnadona-Prevenir S.A.S. ( Site 0609), Barranquilla, Atlantico, 080020, Colombia|Oncomedica S.A. ( Site 0606), Monteria, Cordoba, 230002, Colombia|Fundacion Valle del Lili ( Site 0602), Cali, Valle Del Cauca, 760032, Colombia|Hemato Oncologos S.A. ( Site 0603), Cali, Valle Del Cauca, 760042, Colombia|Centre Francois Baclesse ( Site 1012), Caen, Calvados, 14076, France|CHU-Jean Minjoz ( Site 1013), Besancon, Doubs, 25030, France|Institut Claudius Regaud IUCT Oncopole ( Site 1001), Toulouse, Haute-Garonne, 31059, France|Centre de Cancerologie du Grand Montpellier ( Site 1009), Montpellier, Languedoc-Roussillon, 34070, France|CHR-METZ-THIONVILLE - Hopital de Mercy ( Site 1007), Metz, Moselle, 57085, France|Centre Jean Perrin ( Site 1003), Clermont-Ferrand Cedex 01, Puy-de-Dome, 63001, France|Centre Leon Berard ( Site 1018), Lyon, Rhone, 69373, France|Centre Henri Becquerel ( Site 1020), Rouen, Seine-Maritime, 76038, France|CHU Amiens Hopital Sud ( Site 1023), Amiens, Somme, 80000, France|Institut Gustave Roussy ( Site 1010), Villejuif, Val-de-Marne, 94805, France|Institut Sainte Catherine ( Site 1026), Avignon, Vaucluse, 84918, France|Hôpital Saint-Louis ( Site 1025), Paris, 75010, France|Universitaetsklinikum Mannheim GmbH ( Site 1213), Mannheim, Baden-Wurttemberg, 68167, Germany|Universitaetsklinikum Erlangen ( Site 1201), Erlangen, Bayern, 91054, Germany|Klinik und Poliklinik fuer Frauenheilkunde und Geburtshilfe ( Site 1200), Muenchen, Bayern, 80337, Germany|Hochwaldkrankenhaus Bad Nauheim ( Site 1211), Bad Nauheim, Hessen, 61231, Germany|Sana Klinikum Offenbach Klinik fuer Gynakologie und Geburtshilfe ( Site 1206), Offenbach am Main, Hessen, 63069, Germany|Gynaekologisch-onkologische Praxis Hannover ( Site 1207), Hannover, Niedersachsen, 30177, Germany|Gynaekologisches Zentrum-Schwerpunkt Gyn. Onkologie ( Site 1205), Bonn, Nordrhein-Westfalen, 53111, Germany|Universitaetsklinikum AoeR Duesseldorf ( Site 1210), Duesseldorf, Nordrhein-Westfalen, 40225, Germany|Kliniken Essen-Mitte ( Site 1215), Essen, Nordrhein-Westfalen, 45136, Germany|Frauenklinik St. Louise ( Site 1216), Paderborn, Nordrhein-Westfalen, 33098, Germany|Universitaetsklinikum Carl Gustav Carus ( Site 1203), Dresden, Sachsen, 01307, Germany|Bacs-Kiskun Megyei Korhaz-Onkoradiologiai Kozpont ( Site 1608), Kecskemét, Bacs-Kiskun, 6000, Hungary|Pecsi Tudomanyegyetem Klinikai Kozpont ( Site 1607), Pecs, Baranya, 7624, Hungary|Jasz Nagykun Szolnok Megyei Hetenyi Geza Korhaz Rendelointezet ( Site 1601), Szolnok, Jasz-Nagykun-Szolnok, 5000, Hungary|Zala Megyei Szent Rafael Korhaz ( Site 1605), Zalaegerszeg, Zala, 8900, Hungary|Orszagos Onkologiai Intezet ( Site 1602), Budapest, 1122, Hungary|Debreceni Egyetem Klinikai Kozpont ( Site 1600), Debrecen, 4032, Hungary|Somogy Megyei Kaposi Mor Oktato Korhaz ( Site 1604), Kaposvar, 7400, Hungary|Cork University Hospital ( Site 0902), Cork, T12 DC4A, Ireland|St Vincents University Hospital ( Site 0900), Dublin, D04 YN63, Ireland|Aichi Cancer Center Hospital ( Site 2202), Nagoya, Aichi, 464-8681, Japan|Hyogo College of Medicine Hospital ( Site 2203), Nishinomiya, Hyogo, 663-8501, Japan|Fukushima Medical University Hospital ( Site 2201), Fukushima, 960-1295, Japan|Hiroshima City Hiroshima Citizens Hospital ( Site 2204), Hiroshima, 730-8518, Japan|National Hospital Organization - Osaka National Hospital - Institute For Clinical Research (Site 2200), Osaka, 540-0006, Japan|National Cancer Center ( Site 2406), Goyang-si, Kyonggi-do, 10408, Korea, Republic of|Seoul National University Bundang Hospital ( Site 2409), Seongnam-si, Kyonggi-do, 13605, Korea, Republic of|Ajou University Hospital ( Site 2407), Suwon-si, Kyonggi-do, 16499, Korea, Republic of|Kyungpook National University Chilgok Hospital ( Site 2402), Daegu, Taegu-Kwangyokshi, 41404, Korea, Republic of|Gachon University Gil Medical Center ( Site 2408), Incheon, 21565, Korea, Republic of|Seoul National University Hospital ( Site 2403), Seoul, 03080, Korea, Republic of|Severance Hospital Yonsei University Health System ( Site 2401), Seoul, 03722, Korea, Republic of|Asan Medical Center ( Site 2404), Seoul, 05505, Korea, Republic of|Samsung Medical Center ( Site 2405), Seoul, 06351, Korea, Republic of|Regionalny Szpital Specjalistyczny Latawiec ( Site 1917), Swidnica, Dolnoslaskie, 58-100, Poland|Pratia MCM Krakow ( Site 1919), Krakow, Malopolskie, 30-510, Poland|Narodowy Instytut Onkologii im. Marii Sklodowskiej-Curie - Panstwowy Instytut Badawczy w Warszawie (Site 1908), Warszawa, Mazowieckie, 02-781, Poland|Szpital Morski im. PCK. Szpitale Pomorskie Sp. Z o.o ( Site 1913), Gdynia, Pomorskie, 81-519, Poland|Narodowy Instytut Onkologii - Oddzial w Gliwicach ( Site 1912), Gliwice, Slaskie, 44-102, Poland|Pleszewskie Centrum Medyczne w Pleszewie Sp. z o.o. ( Site 1909), Pleszew, Wielkopolskie, 65-300, Poland|Hospital Universitario Reina Sofia ( Site 0705), Cordoba, Andalucia, 14004, Spain|Hospital General Arnau de Vilanova de Valencia ( Site 0706), Valencia, Valenciana, Comunitat, 46015, Spain|Instituto Oncologico Baselga.Hospital Quiron. ( Site 0707), Barcelona, 08023, Spain|Hospital Universitari Vall d Hebron ( Site 0701), Barcelona, 08035, Spain|Hospital Clinic I Provincial de Barcelona ( Site 0702), Barcelona, 08036, Spain|Clinica Universitaria Navarra - Madrid ( Site 0700), Madrid, 28027, Spain|Kaohsiung Chang Gung Memorial Hospital ( Site 2304), Kaohsiung, 83301, Taiwan|National Cheng Kung University Hospital ( Site 2303), Tainan, 704, Taiwan|MacKay Memorial Hospital ( Site 2301), Taipei, 10449, Taiwan|Koo Foundation Sun Yat-Sen Cancer Center ( Site 2300), Taipei, 112, Taiwan|China Medical University Hospital ( Site 2302), Taipei, 40447, Taiwan|Chernihiv Medical Center of Modern Oncology ( Site 1520), Chernihiv, Chernihivska Oblast, 14029, Ukraine|Dnipropetrovsk City Multidiscipline Clinical Hosp. 4 of DRC ( Site 1502), Dnipro, Dnipropetrovska Oblast, 49102, Ukraine|CI Krivorizhskiy oncology dispensery ( Site 1504), Kryviy Rih, Dnipropetrovska Oblast, 50048, Ukraine|MI Precarpathian Clinical Oncology Center ( Site 1506), Ivano-Frankivsk, Ivano-Frankivska Oblast, 76018, Ukraine|Grigoriev Institute for medical Radiology NAMS of Ukraine ( Site 1508), Kharkiv, Kharkivska Oblast, 61024, Ukraine|Communal non profit enterprise Regional Clinical Oncology Center ( Site 1512), Kharkiv, Kharkivska Oblast, 61070, Ukraine|SI-Zaytsev institute of general and urgent surgery-NAMS ( Site 1518), Kharkiv, Kharkivska Oblast, 61103, Ukraine|Medical Centre Consilium Medical ( Site 1514), Kyiv, Kyivska Oblast, 04050, Ukraine|Medical center of the Limited Liability Company Yulis ( Site 1517), Zaporizhzhia, Zaporizka Oblast, 69035, Ukraine|Medical Centre LLC Oncolife ( Site 1510), Zaporizhzhya, Zaporizka Oblast, 69104, Ukraine|Zhytomyr Regional Oncology Center ( Site 1515), Zhytomyr, Zhytomyrska Oblast, 10002, Ukraine|Medical Center Verum ( Site 1501), Kyiv, 03039, Ukraine|Raigmore Hospital ( Site 0915), Inverness, Highland, IV2 3UJ, United Kingdom|Blackpool Victoria Hospital ( Site 0921), Blackpool, Lancashire, FY3 8NR, United Kingdom|North West Cancer Centre ( Site 0922), Londonderry, London, City Of, BT47 6SB, United Kingdom|Barts Health NHS Trust ( Site 0912), London, London, City Of, EC1M 6BQ, United Kingdom|Musgrove Park Hospital ( Site 0918), Taunton, Somerset, TA1 5DA, United Kingdom|The Christie NHS Foundation Trust ( Site 0914), Manchester, M20 4BX, United Kingdom"
NCT04320693,Expanded Access for IMMU-132,https://clinicaltrials.gov/study/NCT04320693,,APPROVED_FOR_MARKETING,This is an expanded access program (EAP) for eligible participants designed to provide access to IMMU-132.,NO,Metastatic Triple-Negative Breast Carcinoma,DRUG: IMMU-132,,Gilead Sciences,,ALL,"ADULT, OLDER_ADULT",,,INDUSTRY,EXPANDED_ACCESS,IMMU-132,,,,2020-03-25,,2021-08-19,
NCT05770531,Circulating Tumor DNA to Guide Changes in Standard of Care Chemotherapy,https://clinicaltrials.gov/study/NCT05770531,,RECRUITING,"This phase II trial tests how well evaluating circulating tumor deoxyribonucleic acid (ctDNA) works to guide therapy-change decisions in treating patients with triple-negative breast cancer (TNBC) that has spread from where it first started (primary site) to other places in the body (metastatic). This study wants to learn if small pieces of DNA associated with a tumor (called circulating tumor DNA, or ctDNA) can be detected in investigational blood tests during the course of standard chemotherapy treatment for breast cancer, and whether information from such investigational ctDNA blood testing could possibly be used as an early indication of chemotherapy treatment failure. It is hoped that additional information from investigational blood testing for ctDNA could help doctors to switch more quickly from a standard chemotherapy treatment that typically has significant side effects and which may not be working, to a different standard treatment regimen against TNBC, called sacituzumab govitecan. Sacituzumab govitecan is a monoclonal antibody, called hRS7, linked to a chemotherapy drug, called irinotecan. hRS7 is a form of targeted therapy because it attaches to specific molecules (receptors) on the surface of cancer cells, known as TROP2 receptors, and delivers irinotecan to kill them. Studying ctDNA may assist doctors to change therapy earlier if needed, and may improve health outcomes in patients with metastatic TNBC.",NO,Metastatic HER2-Negative Breast Carcinoma|Metastatic Triple-Negative Breast Carcinoma,PROCEDURE: Biospecimen Collection|PROCEDURE: Computed Tomography|PROCEDURE: Magnetic Resonance Imaging|PROCEDURE: Biospecimen Collection|BIOLOGICAL: Sacituzumab Govitecan,"Progression-free survival (PFS), The study survival will be estimated using the Kaplan-Meier method with 95% confidence intervals (CIs). The CI based on the Greenwoods variance will be reported. In addition, the efficacy of the study groups will be compared for PFS with log-rank tests. For multivariate analysis, the proportional hazards Cox model will be applied to investigate potential prognostic factors, such as age, on the survival data. The adjusted p-values of the hazard ratios and the adjusted 95% confidence intervals will be reported., Up to 3 years",Vanderbilt-Ingram Cancer Center,National Cancer Institute (NCI),ALL,"ADULT, OLDER_ADULT",PHASE2,160,OTHER,INTERVENTIONAL,VICCBRE2257|NCI-2023-01721,2023-08-04,2028-08-01,2028-10-01,2023-03-15,,2025-04-04,"Vanderbilt University/Ingram Cancer Center, Nashville, Tennessee, 37232, United States"
NCT05300958,Deferoxamine Plus Chemotherapy for Metastatic Triple Negative Breast Cancer,https://clinicaltrials.gov/study/NCT05300958,,TERMINATED,The objective of the study is to evaluate the efficacy and safety of chemotherapy plus deferoxamine in metastatic breast cancer whose evaluation is stable disease with a trend of progression.,NO,Triple Negative Breast Cancer,DRUG: Deferoxamine Plus Chemotherapy,"Objective Response Rate (ORR), the proportion of patients with tumor size reduction of a predefined amount and for a minimum time period, 6 months",Sun Yat-sen University,,FEMALE,"ADULT, OLDER_ADULT",PHASE2,25,OTHER,INTERVENTIONAL,SYSUCC-017,2022-03-21,2025-07-21,2025-07-21,2022-03-29,,2025-07-22,"Sun Yat-sen University Cancer Center, Guangzhou, Guangdong, 510060, China"
NCT07045311,JS207 Combination Therapy in Triple-negative Breast Cancer,https://clinicaltrials.gov/study/NCT07045311,,NOT_YET_RECRUITING,"This is an open-label, multi-center, phase II clinical study to preliminarily evaluate the efficacy and safety of JS207 combined with 9MW2821 or albumin paclitaxel as first-line therapy in patients with recurrent or metastatic TNBC.",NO,Triple-negative Breast Cancer,DRUG: JS207 in combination with 9MW2821|DRUG: JS207 in combination with Albumin paclitaxel,"ORR, Objective response rate（ORR） evaluated based on Response Evaluation Criteria in Solid Tumors (RECIST) version 1.1 criteria, 2years","Shanghai Junshi Bioscience Co., Ltd.",,ALL,"ADULT, OLDER_ADULT",PHASE2,80,OTHER,INTERVENTIONAL,JS207-008-II-TNBC,2025-07-29,2028-03-22,2029-03-22,2025-07-01,,2025-07-25,"The Fifth Medical Center of PLA General Hospital, Beijing, Beijing, 100071, China|Affiliated Hospital of Hebei University, Baoding, Hebei, 071030, China|Henan Cancer Hospital, Zhangzhou, Henan, 450003, China|Hubei Cancer Hospital, Wuhan, Hubei, 430079, China|Jiangsu Cancer Hospital, Nanjing, Jiangsu, 210009, China|Jiangsu Province Hospital, Nanjing, Jiangsu, 210029, China|Jilin University First Hospital, Changchun, Jilin, 130021, China|The Second Hospital of Dalian Medical University, Dalian, Liaoning, 116027, China|The First Hospital of China Medical University, Shenyang, Liaoning, 110002, China|Liaoning Cancer Hospital&Institute, Shenyang, Liaoning, 110801, China|Ceneral Hosipital of Ningxia Medical University, Yinchuan, Ningxia Hui Autonomous Region, 750000, China|The Affiliated Hospital of Qingdao University, Qingdao, Shandong, 266035, China|The First Affiliated Hospital of Xi'an Jiaotong University, Xian, Shanxi, 710061, China|Xi'an International Medical Center Hospital, Xian, Shanxi, 710100, China|Affiliated Tumor Hospital of Xinjiang Medical University, Ürümqi, Xinjiang Uygur Autonomous Region, 830000, China"
NCT07092254,Patterns of Care and Outcomes in Locally Recurrent Inoperable or Metastatic Triple-Negative Breast Cancer,https://clinicaltrials.gov/study/NCT07092254,,NOT_YET_RECRUITING,"This transnational noninterventional study aims to gather real-world evidence on locally recurrent inoperable (hereafter referred to as advanced) or metastatic TNBC (a/m TNBC) biomarker testing, treatment patterns by line of therapy, and outcomes to contextualize findings of TROPION-Breast02 and TROPION-Breast05 in selected settings outside the United States (US), including Canada, the United Kingdom (UK), France, and Spain.",NO,Triple Negative Breast Cancer,DRUG: No drug,"Treatment sequencing before the diagnosis of advanced, metastatic TNBC (i.e., all treatments received for early TNBC if initially diagnosed with earlier-stage disease), Treatment sequencing Includes broad categories for surgery, radiotherapy, adjuvant and neoadjuvant chemotherapy, immunotherapy, and start and stop dates of systemic therapy., From date of initial diagnosis of early TNBC (if applicable) until diagnosis date of advanced, metastatic TNBC, up to approximately 15 months|Treatment sequencing on or after the diagnosis date for advanced, metastatic TNBC, Treatment sequencing Includes broad categories for surgery, radiotherapy, adjuvant and neoadjuvant chemotherapy, immunotherapy, and start and stop dates of systemic therapy., From date of initial diagnosis of advanced, metastatic TNBC until end of follow-up, up to approximately 15 months|Real-world disease-free interval (rwDFI), Real-world disease-free interval (rwDFI) is assessed from the completion of treatment with curative intent (either date of primary breast tumor surgery or date of last dose of systemic anticancer therapy \[not including endocrine therapy\], whichever occurred last) and the first documented local or distant disease recurrence date, From the completion of treatment with curative intent (either date of breast tumor surgery or date of last dose of systemic therapy (whichever occurred last) and the first local or distant disease recurrence date, up to approximately 15 months|Clinician-defined real-world progression-free survival (rwPFS), Clinician-defined rwPFS is assessed from the index date and from the start of each line of therapy., From the start of each line of therapy until end of follow up, up to approximately 15 months|Overall survival, OS is assessed from the index date and from the start of each line of therapy., From the start of each line of therapy until end of follow-up, up to approximately 15 months|Occurrence of clinical events of interest, The occurrence of the following clinical events of interest will be assessed during each therapy line: Oral mucositis/stomatitis, Interstitial lung disease/pneumonitis, OSE, Diarrhea, Nausea/vomiting, Anemia, Neutropenia, Febrile neutropenia, Leukopenia, Lymphopenia, Thrombocytopenia., From the start of each line of therapy until end of follow-up, up to approximately 15 months",Daiichi Sankyo,,ALL,"ADULT, OLDER_ADULT",,760,INDUSTRY,OBSERVATIONAL,DS1062-0007-NIS-EPI,2025-08-04,2025-10-01,2026-04-08,2025-07-29,,2025-07-29,
NCT06027268,"Phase II Trial of Trilaciclib, Pembrolizumab, Gemcitabine and Carboplatin in Metastatic Triple-Negative Breast Cancer",https://clinicaltrials.gov/study/NCT06027268,ToPCourT,RECRUITING,"The goal of this phase II study is to test the combination of trilaciclib, pembrolizumab, gemcitabine, and carboplatin in locally advanced unresectable or metastatic triple-negative breast cancer.

The main questions it aims to answer are:

* to evaluate the anti-cancer efficacy (assess how well it works)
* to evaluate the safety and tolerability (how well the body can handle the treatment) of this combination of anti-cancer therapy",NO,Metastatic Triple-Negative Breast Cancer,DRUG: Trilaciclib|DRUG: Pembrolizumab|DRUG: Gemcitabine|DRUG: Carboplatin,"Objective Response, Objective according to RECIST v1.1 criteria, 6 months (initiation of protocol directed therapy until either a partial response is achieved or treatment discontinuation)",Wake Forest University Health Sciences,"Merck Sharp & Dohme LLC|G1 Therapeutics, Inc.",ALL,"ADULT, OLDER_ADULT",PHASE2,36,OTHER,INTERVENTIONAL,IRB00095334|LCI-BRE-MTN-TPGC-001,2024-01-10,2026-09,2027-03,2023-09-07,,2025-08-01,"Levine Cancer Institute, Charlotte, North Carolina, 28204, United States"
NCT03244358,Evaluation of Epalrestat in Metastatic Triple-negative Breast Cancer,https://clinicaltrials.gov/study/NCT03244358,,TERMINATED,To evaluate the efficacy and safety of Epalrestat in the treatment of metastatic triple negative breast,NO,Triple Negative Breast Cancer,DRUG: Epalrestat,"Progression-free survival (PFS), the length of time during and after the treatment of a disease, such as cancer, that a patient lives with the disease but it does not get worse, 30 months",Sun Yat-sen University,,FEMALE,"ADULT, OLDER_ADULT",PHASE2,12,OTHER,INTERVENTIONAL,SYSUCC-010,2017-03-01,2020-12-01,2020-12-01,2017-08-09,,2021-01-29,"Sun Yat-sen University, Cancer Center, Guangzhou, Guangdong, 510060, China"
