NCT Number,Study Title,Study URL,Acronym,Study Status,Brief Summary,Study Results,Conditions,Interventions,Primary Outcome Measures,Sponsor,Collaborators,Sex,Age,Phases,Enrollment,Funder Type,Study Type,Other IDs,Start Date,Primary Completion Date,Completion Date,First Posted,Results First Posted,Last Update Posted,Locations
NCT02555657,Study of Single Agent Pembrolizumab (MK-3475) Versus Single Agent Chemotherapy for Metastatic Triple Negative Breast Cancer (MK-3475-119/KEYNOTE-119),https://clinicaltrials.gov/study/NCT02555657,,COMPLETED,"In this study, participants with metastatic triple negative breast cancer (mTNBC) will be randomly assigned to receive either single agent pembrolizumab or single agent chemotherapy chosen by the treating physician (Treatment of Physician's Choice, TPC) in accordance with local regulations and guidelines, consisting of either capecitabine, eribulin, gemcitabine, or vinorelbine. The primary study hypothesis is that pembrolizumab extends overall survival compared to TPC.",YES,Metastatic Triple Negative Breast Cancer,BIOLOGICAL: pembrolizumab|DRUG: capecitabine|DRUG: eribulin|DRUG: gemcitabine|DRUG: vinorelbine,"Overall Survival in Participants With Programmed Cell Death Ligand 1 (PD-L1) With Combined Positive Score (CPS) ≥10, Overall survival (OS) was defined as the time from randomization to death due to any cause., Up to approximately 36 months (through Final Analysis database cutoff date of 11-April-2019)|Overall Survival in Participants With PD-L1 CPS ≥1, Overall survival (OS) was defined as the time from randomization to death due to any cause., Up to approximately 36 months (through Final Analysis database cutoff date of 11-April-2019)|Overall Survival in All Participants, Overall survival (OS) was defined as the time from randomization to death due to any cause., Up to approximately 36 months (through Final Analysis database cutoff date of 11-April-2019)",Merck Sharp & Dohme LLC,,ALL,"ADULT, OLDER_ADULT",PHASE3,622,INDUSTRY,INTERVENTIONAL,3475-119|2015-001020-27|153082|MK-3475-119|KEYNOTE-119,2015-10-13,2019-04-11,2020-11-10,2015-09-21,2020-05-04,2021-12-10,
NCT04024800,Establishing the Recommended Biological Dose for AE37 Peptide Vaccine in Combination With Pembrolizumab That Will Enhance the Tumor-specific Immune Response and Demonstrate Efficacy in Patients With Advanced Triple-negative Breast Cancer,https://clinicaltrials.gov/study/NCT04024800,NSABP FB-14,UNKNOWN,"This study will look to establish the recommended biologic dose of AE37 in combination with pembrolizumab that will enhance the tumor-specific immune response and demonstrate efficacy in patients with advanced triple-negative breast cancer.

This study will take place in two parts. Stage 1 will be the safety cohort (13 patients) to determine the recommended dose of AE37 vaccine that can safely be administered with pembrolizumab. Stage 2 will be an expansion cohort (16 patients) that will consist of the recommended dose of AE37 determined in Stage 1.",NO,Triple-negative Breast Cancer,BIOLOGICAL: AE37 Peptide vaccine|BIOLOGICAL: Pembrolizumab,"Recommended dose, Recommended dose of AE37 that can be safely administered with pembrolizumab. If dose limiting toxicities occur in 4 of the first 13 patients the study therapy vaccine dose will be de-escalated to 500 micrograms (dose-level 1). If fewer than 4 patients experience DLTs then the expansion cohort of 16 patients will be added., Day 1, within 72 hours of vaccination (48-72 hours), and as adverse events occur in each cycle (21 days) of study therapy (first 13 patients).|Objective response rate, Objective response rate determined by RECIST 1.1 with modifications for progressive disease confirmation, From study entry through disease progression or intolerable toxicity for a maximum of 35 cycles (21 days cycle) )or two years.",NuGenerex Immuno-Oncology,Merck Sharp & Dohme LLC|NSABP Foundation Inc,FEMALE,"ADULT, OLDER_ADULT",PHASE2,29,INDUSTRY,INTERVENTIONAL,NSABP FB-14|MK3475 KN 548,2019-05-03,2023-06-30,2024-06-30,2019-07-18,,2021-06-02,"Cancer Care Specialists of Central Illinois, Decatur, Illinois, 62526, United States|Crossroads Cancer Center, Effingham, Illinois, 62401, United States|Cancer Care Specialists of Central Illinois-Swansea, Swansea, Illinois, 62226, United States|Cleveland Clinic, Cleveland, Ohio, 44195, United States|Stefanie Spielman Comprehensive Cancer Center, Columbus, Ohio, 43212, United States|West Virginia University, Morgantown, West Virginia, 26506, United States"
NCT03872791,A Study of KN046 in Subjects With Locally Advanced or Metastatic Triple-negative Breast Cancer,https://clinicaltrials.gov/study/NCT03872791,,COMPLETED,"This is an open-label, phase Ib/II, multi-center study to evaluate efficacy and safety of KN046 alone or in combination with nab-paclitaxel in subjects with locally advanced unresectable or metastatic triple negative breast cancer (TNBC). The study is composed of dose escalation and expansion parts. Every subject will subject tumor tissue used for biomarker evaluation. Each subject will receive KN046 or in combination with nab-paclitaxel untill confirmed progressive disease, unacceptable toxicity or withdrawal of informed consent whichever occurs first.",NO,Triple-negative Breast Cancer,BIOLOGICAL: KN046|DRUG: Nab-paclitaxel,"IRC assessed objective response, Objective response is defined as complete response (CR) or partial response (PR), as determined by the independent review committee using RECIST v1.1 criteria. CR is defined as the disappearance of all TLs and SA reduction to less than (\<) 10mm for nodal TLs/ non-TLs. PR is defined as \>/=30% decrease in SD of TLs, taking as reference the baseline SD, From Day 1 to PD, assessed up to 12 months after last patient last dose|IRC assessed duration of response, Duration of response is defined as the time period from the date of initial independent review committee assessed CR or PR until the date of PD or death from any cause, whichever occurs first. CR is defined as the disappearance of all TLs and SA reduction to \<10mm for nodal TLs/ non-TLs. PR is defined as \>/=30% decrease in SD of TLs, taking as reference the baseline SD. PD is defined as \>/=20% relative increase and \>/=5 mm of absolute increase in the SD of TLs, taking as reference the smallest SD recorded since treatment started, or appearance of 1 or more new lesions, From Day 1 to PD, assessed up to 12 months after last patient last dose","Jiangsu Alphamab Biopharmaceuticals Co., Ltd",,ALL,"ADULT, OLDER_ADULT",PHASE1|PHASE2,52,INDUSTRY,INTERVENTIONAL,KN046-203,2019-05-30,2022-08-16,2022-10-27,2019-03-13,,2023-06-08,"National Cancer Center/Cancer Hospital, Chinese Academy of Medical Sciences and Peking Union Medical College, Beijing, Beijing, China|The First Affiliated Hospital of Xiamen University, Xiamen, Fujian, China|Sun Yat-sen Memorial Hospital, Sun Yat-sen University, Guangzhou, Guangdong, China|Sun Yat-sen University Cancer Center, Guangzhou, Guangdong, China|Harbin Medical University Cancer Hospital, Harbin, Heilongjiang, China|Henan Cancer Hospital, Zhengzhou, Henan, China|Hunan Cancer Hospital, Changsha, Hunan, China|Nantong Tumor Hospital, Nantong, Jiangsu, China|JiLin Cancer Hospital, Changchun, Jilin, China|Liaoning Cancer Hospital, Shenyang, Liaoning, China|LiaoCheng People's Hospital, Liaocheng, Shandong, China|Zibo Municipal Hospital, Zibo, Shandong, China"
NCT05953168,T-DXd in the First-Line Treatment of Locally Advanced or Metastatic TNBC-LAR HER2-low Patients,https://clinicaltrials.gov/study/NCT05953168,,NOT_YET_RECRUITING,"This is an open-label, single-arm phase II trial of first-line treatment with trastuzumab deruxtecan (T-DXd) for patients with locally advanced or metastatic triple-negative breast cancer, luminal androgen receptor subtype (TNBC-LAR) with low HER2 expression.",NO,Triple-Negative Breast Cancer,DRUG: Trastuzumab Deruxtecan,"Objective Response of Complete Response (ORR), Percentage of Participants With an Objective Response of Complete Response (CR) or Partial Response (PR) According to Response Evaluation Criteria in Solid Tumours (RECIST) v1.1 in all Participants, 3 years (assessed at Screening, every 6 weeks for the first 12 months, thereafter every 9 weeks until disease progression or death, whichever occurs first)",Fudan University,,FEMALE,"ADULT, OLDER_ADULT",PHASE2,69,OTHER,INTERVENTIONAL,SCHBCC-N059,2023-08,2024-08,2026-08,2023-07-19,,2023-07-19,"Breast cancer institute of Fudan University Cancer Hospital, Shanghai, Shanghai, 200032, China"
NCT06382142,A Study Comparing BL-B01D1 With Chemotherapy of Physician's Choice in Patients With Unresectable Locally Advanced or Metastatic Triple-Negative Breast Cancer,https://clinicaltrials.gov/study/NCT06382142,,RECRUITING,"This trial is a registered phase III, randomized, open-label, multicenter study designed to evaluate the efficacy and safety of BL-B01D1 in patients with unresectable locally advanced or metastatic Triple-Negative breast cancer after taxane failure.",NO,Triple-Negative Breast Cancer,DRUG: BL-B01D1|DRUG: Eribulin|DRUG: Vinorelbine|DRUG: Gemcitabine|DRUG: Capecitabine,"Progression-free survival (PFS), Progression-free survival (PFS) as assessed by BIRC is defined as the time between the date subjects are randomized and the first observation of disease progression (based on BICR's image-based assessment) or death., Up to approximately 24 months|Overall survival (OS), Overall survival (OS) is defined as the time between the subject's randomization date and subject's death., Up to approximately 24 months","Sichuan Baili Pharmaceutical Co., Ltd.","Baili-Bio (Chengdu) Pharmaceutical Co., Ltd.",ALL,"ADULT, OLDER_ADULT",PHASE3,406,INDUSTRY,INTERVENTIONAL,BL-B01D1-307,2024-06-21,2026-06,2026-06,2024-04-24,,2025-05-02,"Fudan University Shanghai Cancer Center, Shanghai, Shanghai, China"
NCT05174832,Induction of Cisplatin/Nab-paclitaxel/Pembrolizumab Followed by Olaparib/Pembrolizumab Maintenance in mTNBC Patients,https://clinicaltrials.gov/study/NCT05174832,,UNKNOWN,"This study aims to investigate if olaparib plus pembrolizumab will maintain the clinical benefit achieved after induction therapy with Albumin-bound paclitaxel combined with cisplatin(AP) regimen and pembrolizumab in previously untreated locally advanced, recurrent or metastatic TNBC population with PD-L1 CPS≥1.",NO,Triple Negative Breast Cancer,DRUG: Cisplatin|DRUG: Nab-paclitaxel|DRUG: Pembrolizumab|DRUG: Olaparib,"Progression-Free Survival (PFS) According to Response Evaluation Criteria in Solid Tumors Version 1.1 (RECIST 1.1) as assessed by local investigators, PFS is defined as the time from randomization to the first documented disease progression or death due to any cause, whichever occurs first., Up to 36 months",Fudan University,Merck Sharp & Dohme LLC,ALL,"ADULT, OLDER_ADULT",PHASE2,136,OTHER,INTERVENTIONAL,COMPLEMENT,2022-09-07,2023-12-01,2025-03-01,2022-01-03,,2023-09-28,"Fudan University Shanghai Cancer Center, Shanghai, Shanghai, 200032, China"
NCT04438681,Evaluation of a Plasma Protein Profile as a Predictive Biomarker for Metastatic Relapse in Triple Negative Breast Cancer Patients,https://clinicaltrials.gov/study/NCT04438681,INSTIGO,RECRUITING,"The INSTIGO study aims to assess a plasma protein profile at different stages of patient follow-up as a predictive factor of metastatic recurrence in triple negative breast cancer. It also aims to look at other potential biomarkers of metastatic relapse such as Tumor-infiltrating Lymphocytes, circulating tumor DNA, figurative elements in blood, or a tumor RNA signature.",NO,Triple Negative Breast Cancer,,"Identification at diagnosis of a plasma protein profile predictive of metastatic relapse in patients with triple-negative breast cancer (TNBC), - Plasma concentrations of a set of proteins at diagnosis (measured in g/L), 8 years|Identification at diagnosis of a plasma protein profile predictive of metastatic relapse in patients with triple-negative breast cancer (TNBC), - Time to metastatic relapse, 8 years",Centre Jean Perrin,,FEMALE,"ADULT, OLDER_ADULT",,90,OTHER,OBSERVATIONAL,2020-A01423-36,2020-11-27,2026-11-09,2029-11-09,2020-06-19,,2025-02-19,"Centre Jean PERRIN, Clermont-Ferrand, 63011, France"
NCT03193853,TAK-228 and TAK-117 Followed by Cisplatin and Nab Paclitaxel for Metastatic Triple Negative Breast Cancer,https://clinicaltrials.gov/study/NCT03193853,,COMPLETED,This study evaluates efficacy of TAK- 228 and TAK- 117 followed by cisplatin and nab paclitaxel in patients with metastatic triple negative breast cancer.,YES,Triple Negative Breast Cancer,DRUG: Tak-228 & Tak-117|DRUG: Cisplatin & Nab Paclitaxel,"Efficacy (Objective Response Rate), To assess the objective response rate associated with sequential treatment of the oral combination TAK 228 and 117 followed by nab-paclitaxel plus cisplatin in metastatic TNBC. Objective response is measured as prolonged clinical benefit; clinical benefit is defined as progression free survival on study therapy for at least 6 months., Through study completion, up to 2 years 8 months",Joyce O'Shaughnessy,Takeda,FEMALE,"ADULT, OLDER_ADULT",PHASE2,12,OTHER,INTERVENTIONAL,017- 113|Baylor 017-113,2017-07-18,2020-03-17,2022-12-01,2017-06-21,2023-05-09,2023-08-07,"Baylor University Medical Center, Dallas, Texas, 75246, United States"
NCT04464174,Ipatasertib Plus Non-Taxane Chemotherapy for Advanced or Metastatic Triple-Negative Breast Cancer,https://clinicaltrials.gov/study/NCT04464174,PATHFINDER,COMPLETED,"This is a multicenter, open-label, non-comparative, three-arm, phase IIa trial of Ipatasertib (GDC-0068) in combination with non-taxane chemotherapy agents for taxane-pretreated unresectable locally advanced or metastatic triple-negative breast cancer patients",NO,Triple Negative Breast Cancer,DRUG: Ipatasertib|DRUG: Capecitabine|DRUG: Eribulin|DRUG: Carboplatin|DRUG: Gemcitabine,"Safety and tolerability of ipatasertib (GDC-0068) in combination with capecitabine, eribulin, or carboplatin plus gemcitabine; as incidence of Adverse Events as assessed by the investigator, with severity determined through the use of NCI-CTCAE v.4.03, To evaluate the safety and tolerability of ipatasertib (400 mg) in combination with capecitabine, eribulin, or carboplatin plus gemcitabine, From baseline up to 15 months",MedSIR,Hoffmann-La Roche,FEMALE,"ADULT, OLDER_ADULT",PHASE2,54,OTHER,INTERVENTIONAL,MedOPP253|2018-004648-44,2020-10-08,2023-11-10,2023-11-10,2020-07-09,,2024-07-26,"Champalimaud Clinical Centre - Champalimaud Foundation, Lisboa, 1400-038, Portugal|Instituto Português de Oncologia do Porto FG, EPE (IPO-Porto), Porto, 4200-072, Portugal|Hospital Provincial de Castellón, Castellón De La Plana, Castellón, 12002, Spain|Hospital Clínico Universitario Virgen de la Arrixaca, El Palmar, Murcia, 30120, Spain|Hospital del Mar, Barcelona, 08003, Spain|Hospital Universitari Dexeus, Barcelona, Spain|Hospital San Pedro de Alcántara, Cáceres, 10003, Spain|Hospital Universitari Arnau de Vilanova, Lleida, 25198, Spain|Hospital Quiron San Camilo- Ruber Juan Bravo, Madrid, 28006, Spain|Hospital Universitario Ramón y Cajal, Madrid, 28034, Spain|Hospital Universitario Virgen de la Victoria, Málaga, 29010, Spain|Hospital Clínico Universitario de Valencia, Valencia, 46010, Spain|Hospital Arnau de Vilanova, Valencia, 46015, Spain|Hospital Universitario Miguel Servet, Zaragoza, 50009, Spain"
NCT05192798,Albumin-Bound Paclitaxel Combined With Antiangiogenic Agents in First-line Treatment of Relapsed or Metastatic TNBC,https://clinicaltrials.gov/study/NCT05192798,,RECRUITING,"This is a prospective, randomized, open-label clinical study. 128 patients with relapsed or metastatic triple-negative breast cancer (TNBC) who had not been systematically treated are going to be enrolled and randomly assigned to 3 groups. Group A: albumin-bound paclitaxel (260mg/m2, intravenous infusion, once every 3 weeks). Group B: albumin-bound paclitaxel (260mg/m2, intravenous infusion, once every 3 weeks)+ apatinib mesylate tablet (500 mg, orally, once daily, every 3 weeks). Group C: albumin-bound paclitaxel (260mg/m2, intravenous infusion, once every 3 weeks) + bevacizumab (7.5mg/kg, intravenous infusion, once every 3 weeks). The dosages of therapeutic drugs are allowed to be adjusted appropriately according to the toxic reaction of the patients. Patients in three groups continued to take medication until disease progression/death/toxicity was intolerable/the patient or investigator decided to discontinue the medication.

The primary endpoint is progression-free survival (PFS). Secondary endpoints are objective response rate (ORR), clinical benefit rate (CBR, complete response (CR)+ partial response (PR) + stable disease (SD, \> 6 months)), overall survival (OS), adverse events (AE), and potential predictive biomarker parameters related to treatment response (VEGF-A expression level) in peripheral blood.",NO,Triple-negative Breast Cancer,DRUG: Albumin-Bound Paclitaxel|DRUG: Apatinib Mesylate|DRUG: Bevacizumab,"Progression-free Survival (PFS), PFS is defined as the time from randomization until objective tumor progression or death., 2 Years.",The First Affiliated Hospital of Bengbu Medical University,,FEMALE,"ADULT, OLDER_ADULT",PHASE2,128,OTHER,INTERVENTIONAL,BYEC20211201,2022-01-14,2025-09-10,2025-12-01,2022-01-14,,2025-02-27,"Department of Medical Oncology, First Affiliated Hospital of Bengbu Medical College, Bengbu, Anhui, 233004, China"
NCT01745367,Tivozanib in Combination With Paclitaxel in Patients With Locally Recurrent or Metastatic Triple Negative Breast Cancer,https://clinicaltrials.gov/study/NCT01745367,BATON-BC,TERMINATED,"This is a phase 2 multicenter, double-blind, randomized, placebo-controlled, two-arm study for subjects with locally recurrent or metastatic triple negative breast cancer.",YES,Triple Negative Breast Cancer,DRUG: Tivozanib Hydrochloride|DRUG: paclitaxel|DRUG: Placebo,"Comparison of Progression-free Survival (PFS) of Subjects, PFS is defined as the time from randomization to progressive disease (PD) or death. The PFS comparison was performed for subjects treated with tivozanib hydrochloride in combination with paclitaxel vs placebo in combination with paclitaxel., approximately 24 months","AVEO Pharmaceuticals, Inc.",Astellas Pharma Inc,FEMALE,"ADULT, OLDER_ADULT",PHASE2,30,INDUSTRY,INTERVENTIONAL,AV-951-12-204|2012-003507-35,2012-11,2014-06,2014-06,2012-12-10,2020-10-27,2020-10-27,"Birmingham, Alabama, 35005, United States|Jacksonville, Florida, 32034, United States|Miami, Florida, 33018, United States|Atlanta, Georgia, 30301, United States|Chicago, Illinois, 60007, United States|Oak Lawn, Illinois, 60456, United States|Fort Wayne, Indiana, 46774, United States|Indianapolis, Indiana, 46077, United States|Baltimore, Maryland, 21201, United States|Boston, Massachusetts, 01841, United States|Saint Louis, Missouri, 63101, United States|Bronx, New York, 10453, United States|New York, New York, 10001, United States|Chapel Hill, North Carolina, 27514, United States|Fargo, North Dakota, 58102, United States|Charleston, South Carolina, 02129, United States|Sioux Falls, South Dakota, 57101, United States|Memphis, Tennessee, 37501, United States|Dallas, Texas, 75001, United States|Galveston, Texas, 77550, United States|Port Macquarie, New South Wales, Australia|Woodville South, South Australia, Australia|Bentleigh, Victoria, 3204, Australia|Newcastle, Australia|South Brisbane, Australia|St Leonards, Australia|Nassau, Bahamas|Calgary, Alberta, Canada|Edmonton, Alberta, Canada|Vancouver, British Columbia, Canada|Toronto, Ontario, Canada|Saint John, Canada|Berlin, Germany|Cologne, Germany|Hanau am Main, 63454, Germany|Leipzig, Germany|Muenster, Germany|Tuebingen, Germany|Avellino, Italy|Milano, Italy|Roma, Italy|Torino, Italy|Viterbo, Italy|Seoul, Korea, Republic of|Barcelona, Spain|Madrid, Spain|Malaga, Spain|Sevilla, Spain|Kaohsiung, Taiwan|Taipei, Taiwan|Dnipropetrovsk, Ukraine|Donetsk, Ukraine|Uzhhorod, Ukraine|Vinnytsia, Ukraine"
NCT05806060,Precise Treatment for BLIS Subtype of TNBC in the First-line Treatment of Locally Advanced or Metastatic Breast Cancer,https://clinicaltrials.gov/study/NCT05806060,BCTOP-T-M01,RECRUITING,The study is being conducted to evaluate VEGFR BP102 with nab-paclitaxe or treatment of physician's choice (TPC) versus nab-paclitaxe or TPC in patients for basal-like immune suppressed (BLIS) subtype of triple-negative breast cancer (TNBC) in the first-line teatment of unresectable locally advanced or metastatic TNBC.,NO,Triple-Negative Breast Cancer,"DRUG: VEGFR and nab-paclitaxel, with maintenance of VEGFR and capecitabine|DRUG: nab-paclitaxel, with maintenance of capecitabine|DRUG: Eribulin Mesylate/Vinorelbine/Capecitabine/Carboplatin/UTD1|DRUG: VEGFR and TPC","PFS, time to progressive disease (according to RECIST1.1), Randomization until the first occurrence of disease progression or death from any cause, which ever occurs first, through the end of study (approximately 1.5 years)",Fudan University,,FEMALE,"ADULT, OLDER_ADULT",PHASE3,192,OTHER,INTERVENTIONAL,FUSCC-TNBC-BLIS,2023-04-25,2025-08-31,2026-02-28,2023-04-10,,2024-02-08,"Breast cancer institute of Fudan University Cancer Hospital, Shanghai, Shanghai, 200032, China"
NCT04986852,Olinvacimab With Pembrolizumab in Patients With mTNBC,https://clinicaltrials.gov/study/NCT04986852,,RECRUITING,The objective is to evaluate the efficacy and safety of Olinvacimab in combination with Pembrolizumab in patients with mTNBC.,NO,Metastatic Triple-Negative Breast Cancer,DRUG: Olinvacimab,"Objective response rate (ORR), ORR is defined as the proportion of subjects who achieve a best overall response (BOR) of complete response (CR) or partial response (PR). RECIST 1.1 will be used to determine ORR and patients with no post baseline tumor assessments, will be classified as non-responders, Baseline upto 24 months",PharmAbcine,Merck Sharp & Dohme LLC,ALL,"ADULT, OLDER_ADULT",PHASE2,30,INDUSTRY,INTERVENTIONAL,PMC_TTAC-0001_06 / KEYNOTE-C14,2021-09-30,2025-02-28,2026-08-30,2021-08-03,,2023-11-18,"Hollywood Private Hospital, Nedlands, Western Australia, 6009, Australia"
