NCT Number,Study Title,Study URL,Acronym,Study Status,Brief Summary,Study Results,Conditions,Interventions,Primary Outcome Measures,Sponsor,Collaborators,Sex,Age,Phases,Enrollment,Funder Type,Study Type,Other IDs,Start Date,Primary Completion Date,Completion Date,First Posted,Results First Posted,Last Update Posted,Locations
NCT05035745,Selinexor & Talazoparib in Advanced Refractory Solid Tumors; Advanced/Metastatic Triple Negative Breast Cancer (START),https://clinicaltrials.gov/study/NCT05035745,,RECRUITING,"This is a single arm, open-label, phase I dose finding study, followed by a phase II expansion study. Phase I will be carried out in a modified 3+3 dose escalation design, with a projected enrolment of 33 patients with refractory solid tumors to determine the RP2D. In the phase II portion, a total of 30 patients with advanced/metastatic TNBC will be enrolled.",NO,Advanced Refractory Solid Tumors|Advanced Triple Negative Breast Cancers|Metastatic Triple Negative Breast Cancers,DRUG: Talazoparib|DRUG: Selinexor,"safety profile of combination of Talazoparib and Selinexor in advanced/ metastatic solid tumors using NCI CTCAE toxicity grading version 5.0., Patients with advanced/ metastatic triple negative breast cancer, unselected for known platinum sensitivity or resistance, will be enrolled. A pilot of 10 patients will be enrolled. If 0-1 patients achieve an objective response, the combination is deemed to be of no interest for further development. If 2 or more of 10 patients achieve an objective response, another 20 patients will be enrolled to confirm the objective response rate. In the final Safety evaluations will be performed for all patients prior to each cycle of treatment, and include taking a medical history, physical examination, adverse event documentation, full blood count, renal function, liver function tests and electrocardiogram (ECG).

Toxicities will be graded using the NCI CTCAE toxicity grading version 5.0., 5 years","National University Hospital, Singapore",,ALL,"ADULT, OLDER_ADULT",PHASE1|PHASE2,63,OTHER,INTERVENTIONAL,MC01/05/20; IST-325 (KPT),2021-03-01,2027-11,2027-11,2021-09-05,,2025-07-25,"National University Hospital, Singapore, Singapore"
NCT06365788,Bicalutamide and Abemaciclib in Inoperable or Metastatic Androgen Receptor-positive Triple-negative Breast Cancer,https://clinicaltrials.gov/study/NCT06365788,ABBICAR,RECRUITING,This study has as goal to evaluate the use of abemaciclib and bicalutamide in androgen receptor positive metastatic triple negative breast cancer.,NO,Triple Negative Breast Neoplasms,DRUG: Abemaciclib|DRUG: Bicalutamide,"Number of participants with disease control at 16 weeks, Disease control rate at week 16 in all patients (cohorts A, B, C and D combined) treated at the selected dose level. DCR is defined as the proportion of patients that present with stable disease, partial response or complete response per RECIST 1.1 at 16 weeks after treatment initiation., Week 16",Universitaire Ziekenhuizen KU Leuven,Kom Op Tegen Kanker|Eli Lilly and Company|Teva Pharma,FEMALE,"ADULT, OLDER_ADULT",PHASE2,53,OTHER,INTERVENTIONAL,S66466|2022-502272-23-00,2024-04-08,2027-12,2028-12,2024-04-15,,2025-07-30,"Antwerp University Hospital, Antwerp, Belgium|Gasthuiszusters Antwerpen, Antwerp, Belgium|University Hospital Brussels, Brussel, Belgium|Ghent University Hospital, Ghent, Belgium|Jessa Ziekenhuis, Hasselt, Belgium|University Hospitals Leuven, Leuven, Belgium"
NCT05451784,Treatment of Advanced or Metastatic Triple-negative Breast Cancer With Adoptive Therapy of PD1+ TILS,https://clinicaltrials.gov/study/NCT05451784,TILS001,RECRUITING,"This is a prospective, multicenter, phase I/II, open-label, two-stage design of PD1+ TILs infusion in metastatic or advanced TNBC. TILS001 includes 3 parts. Previous to each phase inclusion, a specific ICF must be signed by the patient. Participants potentially eligible to participate in the clinical trial will be offered to sign a ICF three times prior to TILs treatment: 1) to allow for collection of archival FFPE tissue samples for determination PD1 by mRNA (Part #1), 2) prior to a fresh metastatic biopsy for selection, isolation and partial expansion of PD1+ TILs (Part #2) and 3) prior to allow for remaining study procedures and TILs therapy (Part #3, Main Consent).",NO,Metastatic Triple-Negative Breast Carcinoma,DRUG: PD1+ TILs (NUMARZU-001) product infusion,"Incidence of grade 3-5 adverse event (AE), Incidence of grade 3-5 adverse event (AE) assessed by the NCI Common Terminology for Classification of Adverse Events (CTCAE) version 5.0, and any grade AE assessed by CTCAE that leads to treatment discontinuation and possibly related to treatment, that occur in the first 24h following PD1+ TILs infusion (prior to IL-2 treatment).

* Incidence of grade 3-5 AEs assessed by the NCI CTCAE version 5.0 taking into account the whole process, which includes NMA-LD chemotherapy followed by TILs infusion and at least one dose of IL-2 treatment.
* All changes in treatment administration including delays, interruptions, reductions or discontinuation and the main reason(s) for these changes., 24 weeks from the administration of PD1+ TILS (NUMARZU-001 product)|Overall response rate (ORR), Overall response rate (ORR) locally determined as the best response (defined as CR and PR) by the investigator according to RECIST 1.1 criteria from the administration of PD1+ TILS (NUMARZU-001 product); on day 0, 24 weeks from the administration of PD1+ TILS (NUMARZU-001 product)",Fundacio Clinic Barcelona,SOLTI Breast Cancer Research Group,ALL,"ADULT, OLDER_ADULT",PHASE1|PHASE2,20,OTHER,INTERVENTIONAL,TILS001 trial,2022-07-20,2025-11-30,2027-09-30,2022-07-11,,2023-11-24,"Hospital Universitari Vall d'Hebrón, Barcelona, 08035, Spain|Hospital Clinic de Barcelona, Barcelona, 08036, Spain|Hospital 12 de Octubre, Madrid, 28041, Spain|Clínica universidad de Navarra, Pamplona, 31008, Spain"
NCT05742269,Molecular PD-L1 PET/CT Imaging With 89Zr-atezolizumab in Metastatic Triple Negative Breast Cancer,https://clinicaltrials.gov/study/NCT05742269,MIMIR-mTNBC,RECRUITING,"The overarching purpose of this study is to improve precision medicine through more refined therapy selection for breast cancer patients who are candidates for ICI therapy (monoclonal antibodies targeting the programmed death ligand 1 (PD-L1) or programmed cell death protein 1 (PD-1)). The reference standard biomarker for ICI therapy selection is PD-L1 protein expression measured by immunohistochemistry (IHC). Several disadvantages exist with this method, the most important ones being inter- and intralesional as well as spatial heterogeneity in PD-L1 expression, as well as the need for invasive procedures to obtain material for analysis. The study hypothesis is that Positron Emission Tomography combined with Computed Tomography (PET/CT) imaging with a contemporary radiotracer (89Zr-atezolizumab), visualizing PD-L1 expression in the whole body, could be a better predictive biomarker to select which patients benefit from ICI. The use of PET/CT imaging with new radiotracers enables a non-invasive assessment of the presence of the target of treatment in the whole body and provides the possibility to combine functional information with anatomical details.",NO,Metastatic Triple-Negative Breast Carcinoma,DIAGNOSTIC_TEST: 89Zr-atezolizumab PET/CT,"Level of statistical agreement (Cohen kappa coefficient) between PD-L1 status on IHC (with SP142 Ventana) and PET (with 89Zr-atezolizumab), Level of statistical agreement by means of Cohen's kappa coefficient between PD-L1 IHC (positive defined as expression ≥1% on immune cells with SP142) and PD-L1 PET/CT (PD-L1 positivity is defined as having at least one lesion with radiotracer uptake over the background uptake).

Level of statistical agreement by means of Cohen's kappa coefficient between PD-L1 IHC (positive defined as expression ≥1% on immune cells with SP142) and PD-L1 PET/CT (PD-L1 positivity is defined as having at least one lesion with radiotracer uptake over the background uptake).

Level of statistical agreement by means of Cohen's kappa coefficient between PD-L1 IHC (positive defined as expression ≥1% on immune cells with SP142) and PD-L1 PET/CT (PD-L1 positivity is defined as having at least one lesion with radiotracer uptake over the background uptake)., baseline",Karolinska University Hospital,,ALL,"ADULT, OLDER_ADULT",,64,OTHER,OBSERVATIONAL,MIMIR-mTNBC,2023-07-01,2024-12-01,2025-03-31,2023-02-23,,2025-02-26,"Karolinska University Hospital, Stockholm, 171 76, Sweden"
NCT03742102,A Study of Novel Anti-cancer Agents in Patients With Metastatic Triple Negative Breast Cancer,https://clinicaltrials.gov/study/NCT03742102,BEGONIA,ACTIVE_NOT_RECRUITING,This study is designed to determine the efficacy and safety of durvalumab in combination with novel oncology therapies with or without paclitaxel and durvalumab + paclitaxel for first-line metastatic triple negative breast cancer,NO,Triple Negative Breast Neoplasms,DRUG: Durvalumab|DRUG: Capivasertib|DRUG: Oleclumab|DRUG: Paclitaxel|DRUG: Trastuzumab deruxtecan|DRUG: Datopotamab deruxtecan,"Incidence of adverse events, Part 1: Assessment of safety and tolerability of each treatment arm

Part 2:

Endpoints based on Investigator assessment according to RECIST 1.1: ORR (objective response rate): The percentage of evaluable patients with a confirmed Investigator-assessed visit response of CR (complete response) or PR (partial response)., Part1: From informed consent until the safety follow-up visit 3 months after the last dose of study drug. Part 2: From informed consent until the safety follow-up visit 3 months after the last dose of study drug.|Laboratory findings, Assessment of safety and tolerability of each treatment arm, Part 1: From informed consent until the safety follow-up visit 3 months after the last dose of study drug. Part 2:From informed consent until the safety follow-up visit 3 months after the last dose of study drug.",AstraZeneca,,FEMALE,"ADULT, OLDER_ADULT",PHASE1|PHASE2,242,INDUSTRY,INTERVENTIONAL,D933LC00001|2018-000764-29,2018-12-21,2024-11-29,2027-02-26,2018-11-15,,2025-06-25,"Research Site, Tucson, Arizona, 85715, United States|Research Site, Columbia, Maryland, 21044, United States|Research Site, Boston, Massachusetts, 02114, United States|Research Site, Boston, Massachusetts, 02215, United States|Research Site, Grand Rapids, Michigan, 49503, United States|Research Site, Saint Louis, Missouri, 63110, United States|Research Site, Dallas, Texas, 75246, United States|Research Site, Williamsburg, Virginia, 23188, United States|Research Site, Kelowna, British Columbia, V1Y 5L3, Canada|Research Site, London, Ontario, N6A 5W9, Canada|Research Site, Greenfield Park, Quebec, J4V 2H1, Canada|Research Site, Montreal, Quebec, H4A 3J1, Canada|Research Site, Seoul, 03080, Korea, Republic of|Research Site, Seoul, 05505, Korea, Republic of|Research Site, Seoul, 06351, Korea, Republic of|Research Site, Gdańsk, 80-952, Poland|Research Site, Kraków, 31-501, Poland|Research Site, Lublin, 20-090, Poland|Research Site, Opole, 45-060, Poland|Research Site, Rzeszów, 35-021, Poland|Research Site, Warszawa, 02-781, Poland|Research Site, Warszawa, 04-141, Poland|Research Site, Kaohsiung, 80756, Taiwan|Research Site, Taichung, 40447, Taiwan|Research Site, Tainan City, 70403, Taiwan|Research Site, Taipei, 10002, Taiwan|Research Site, Taipei, 112, Taiwan|Research Site, Taoyuan, 333, Taiwan|Research Site, Cambridge, CB2 0QQ, United Kingdom|Research Site, London, EC1M 6BQ, United Kingdom|Research Site, Manchester, M20 4BX, United Kingdom|Research Site, Oxford, OX3 7LE, United Kingdom"
NCT03692689,Safety and Efficacy of SCT200 in Patients With Relapsed or Metastatic Triple Receptor Negative Breast Cancer,https://clinicaltrials.gov/study/NCT03692689,,UNKNOWN,The purpose of this study is to evaluate the efficacy and safety of recombinant anti-EGFR monoclonal antibody（SCT200）in patients with triple receptor negative breast cancer treated after failure of standard therapy (including Anthracyclines and/or Taxanes).,NO,Triple Negative Breast Neoplasms,BIOLOGICAL: SCT200,"Objective response rate (ORR), ORR is defined as proportion of patients achieving complete response (CR) or partial response (PR) according to RECIST v1.1 during trial treatment., 1 year",Sinocelltech Ltd.,,FEMALE,"ADULT, OLDER_ADULT",PHASE2,30,INDUSTRY,INTERVENTIONAL,SCT200IITNBC,2018-07-20,2019-09-30,2019-12-31,2018-10-02,,2018-10-02,"Cancer Hospital Affiliated to Harbin Medical University, Harbin, Heilongjiang, 150081, China"
NCT04634747,"Phase 2 Study to Evaluate PVX-410 + Pembrolizumab + Chemotherapy for Metastatic, PD-L1+ Triple-Negative Breast Cancer",https://clinicaltrials.gov/study/NCT04634747,,UNKNOWN,"Evaluating the combination of the investigational, multi-peptide cancer vaccine PVX-410 in combination with pembrolizumab and chemotherapy in treatment naive patients with metastatic, triple negative breast cancer who are PDL1 and HLA A2 positive.",NO,Metastatic Triple-Negative Breast Carcinoma,DRUG: PVX-410,"Progression Free Survival, 8 months","OncoPep, Inc.",,ALL,"ADULT, OLDER_ADULT",PHASE2,53,INDUSTRY,INTERVENTIONAL,2020-001,2022-04-30,2023-04-01,2025-04-01,2020-11-18,,2022-04-20,
NCT06505018,"Telemonitoring Platform ""CUREETY TECHCARE"" vs Standard of Care for mTBNC Patients Initiating a First-line Treatment",https://clinicaltrials.gov/study/NCT06505018,ALTERNATIVE,RECRUITING,"The goal of this clinical trial is to assess whether adding telemonitoring (the digital telemonitoring platform ""CUREETY TECHCARE""), to standard care, will benefit patients with previously untreated metastatic triple-negative breast cancer starting first-line cancer therapy.

The main questions it aims to answer are:

* Is patient quality of life improved by using the telemonitoring platform?
* Are patients hospitalized less frequently when using the telemonitoring platform?
* Is the patient overall survival improved by telemonitoring ?

Researchers will compare data from patients using telemonitoring while receiving standard care with data from patients receiving only standard care.

Participants using telemonitoring will answer questions about their symptoms on the platform. The platform will analyze these symptoms, assess the patient's general condition and provide advice accordingly. Medical staff will also access the platform to monitor the patient's general condition and contact them if necessary.",NO,Metastatic Triple-Negative Breast Carcinoma,DEVICE: Cureety techcare,"Time to definitive Health-Related Quality of life score Deterioration, The time to definitive Health-Related Quality of life score Deterioration is the length of time from randomization to the first deterioration of ≥ 10 points out of 100 or ≥2 points out of 14 in the global health status (GHS) score (items 29 and 30 of the QLQ-C30) compared with the baseline, assuming no improvement of at least 2 points in the GHS score compared with the baseline has occurred.

The responses to the items 29-30 of the QLQ-C30 will be scored using the QLQ scoring manual. These 2 items have possible values ranging from 1 (very bad) to 7 (excellent) corresponding to a sum from 2 to 14 points. After conversion to percentages, the GHS will range from 0% to 100%. The higher the value, the better the quality of life., At baseline then every 3 months, up to 24 months|Hospitalization-free survival, Hospitalization-free survival is the length of time from randomization during which patients enrolled in the study are not hospitalized and remain alive., From randomization to death from any cause, up to 24 months|Overall survival, overall survival is the length of time from randomization during which patients enrolled in the study remain alive., From randomization to death from any cause, up to 24 months after last inclusion",UNICANCER,Cureety,ALL,"ADULT, OLDER_ADULT",NA,472,OTHER,INTERVENTIONAL,UC-BCG-2309|IDRCB NUMBER: 2023-A02477-38,2024-07-25,2026-05-02,2027-09-02,2024-07-17,,2024-07-26,"Institut de Cancérologie des Hauts-de-France (ICHF), Arras, France|Centre Hospitalier d'Auxerre, Auxerre, France|Sainte Catherine - Institut du Cancer Avignon Provence, Avignon, France|CH Aunay-Bayeux, Bayeux, France|Centre Hospitalier Simone Veil de Beauvais, Beauvais, France|ICHF - Centre Pierre Curie, Beuvry, France|Hôpital Simone Veil de Blois, Blois, France|Polyclinique bordeaux nord, Bordeaux, France|Centre Hospitalier Fleyriat, Bourg-en-Bresse, France|Centre de Cancérologie Privé de Caen Maurice Tubiana, Caen, France|Centre Francois Baclesse, Caen, France|Centre hospitalier de Carcasonne, Carcassonne, France|Recherche Oncologie Clinqiue 37 (ROC 37), Chambray-lès-Tours, France|CH de Cholet, Cholet, France|CH Colmar, Colmar, France|Groupe Hospitalier Public du Sud de l'Oise (GHPSO), Creil, France|Centre Georges François Leclerc, Dijon, France|Institut Andrée Dutreix, Dunkerque, France|Centre Hospitalier Intercommunal de Fréjus Saint Raphael, Fréjus, France|Groupe Hospitalier Mutualiste de Grenoble, Grenoble, France|Groupe Hospitalier de La Rochelle-Ré-Aunis, La Rochelle, France|CHU de la réunion, La Réunion, France|Clinique Sainte Clotilde, La Réunion, France|CHU Grenoble Alpes, La Tronche, France|Centre Hospitalier Louis Pasteur, Le Coudray, France|Centre Hospitalier Le Mans, Le Mans, France|Centre Hospitalier Emile Roux, Le Puy-en-Velay, France|GHBS Lorient, Lorient, France|Centre Leon Berard, Lyon, France|Clinique de la Sauvegarde, Lyon, France|Hôpital Privé Jean Mermoz, Lyon, France|Institut Paoli Calmettes, Marseille, France|CHI de Mont-de-Marsan et du Pays des Sources, Mont-de-Marsan, France|Centre de Cancérologie du Grand Montpellier, Montpellier, France|Hôpital Privé du Confluent, Nantes, France|Clinique Ambroise-Pare Hartmann, Neuilly-sur-Seine, France|Hôpital Américain de PARIS, Neuilly-sur-Seine, France|CHU de Nimes, Nîmes, France|CHR Orleans, Orléans, France|CHP Sainte-Marie, Osny, France|Diaconesses Croix Saint-Simon Hospital Complex, Paris, France|Centre hospitalier de Pau, Pau, France|CARIO - Hopital Privé des Cotes d'Armor, Plérin, France|CHU de Poitiers, Poitiers, France|Institut Godinot, Reims, France|Clinique Mathilde - Les Hôpitaux Privés Rouennais, Rouen, France|Hia Begin, Saint-Mandé, France|CHU de Saint-Etienne, Saint-Étienne, France|CHU de Tours, Tours, France|Institut de Cancérologie de Lorraine, Vandœuvre-lès-Nancy, France|CH Annecy Genevois, Épagny, France"
NCT03310957,Safety and Efficacy of SGN-LIV1A Plus Pembrolizumab for Patients With Locally-Advanced or Metastatic Triple-Negative Breast Cancer,https://clinicaltrials.gov/study/NCT03310957,,COMPLETED,This trial studies ladiratuzumab vedotin (LV) with pembrolizumab in patients with triple-negative breast cancer. It will find out what side effects happen when participants get these two drugs. A side effect is anything the drugs do besides treating cancer. Pembrolizumab is a drug that can be used to treat triple-negative breast cancer. The trial will also find out if these drugs work to treat this type of cancer. Participants in this study have metastatic breast cancer. This means the cancer has spread to other parts of the body.,NO,Triple Negative Breast Neoplasms,DRUG: ladiratuzumab vedotin|DRUG: Pembrolizumab,"Confirmed objective response rate, Confirmed ORR as determined by investigator according to RECIST v 1.1, Up to 18 weeks following last dose; approximately 1 year|Incidence of adverse events, Through 1 month following last dose; approximately 10 months|Incidence of laboratory abnormalities, Through 1 month following last dose; approximately 10 months|Incidence of dose-limiting toxicities, Through 1 month following last dose; approximately 10 months",Seagen Inc.,Merck Sharp & Dohme LLC,ALL,"ADULT, OLDER_ADULT",PHASE1|PHASE2,186,INDUSTRY,INTERVENTIONAL,SGNLVA-002|KEYNOTE 721|2017-002289-35|MK-3475-721,2018-02-27,2024-09-30,2024-09-30,2017-10-16,,2024-12-20,"University of Alabama at Birmingham, Birmingham, Alabama, 35249, United States|Cedars Sinai Medical Center / Samuel Oschin Comprehensive Cancer Institute, Los Angeles, California, 90048, United States|Chao Family Comprehensive Cancer Center University of California Irvine, Orange, California, 92868, United States|University of California Irvine - Newport, Orange, California, 92868, United States|Rocky Mountain Cancer Centers - Aurora, Aurora, Colorado, 80012, United States|The Whittingham Cancer Center / Norwalk Hospital, Norwalk, Connecticut, 06856, United States|Helen F. Graham Cancer Center / Christiana Care Health Systems, Newark, Delaware, 19713, United States|Miami Cancer Institute at Baptist Health, Inc., Miami, Florida, 33176, United States|AdventHealth Cancer Institute, Orlando, Florida, 32804, United States|H. Lee Moffitt Cancer Center and Research Institute, Tampa, Florida, 33612, United States|Piedmont Cancer Institute, Atlanta, Georgia, 30309, United States|Winship Cancer Institute / Emory University School of Medicine, Atlanta, Georgia, 30322, United States|Ingalls Cancer Care / Ingalls Memorial Hospital, Harvey, Illinois, 60426, United States|Cardinal Bernardin Cancer Center / Loyola University Medical Center, Maywood, Illinois, 60153, United States|University of Maryland, Baltimore, Maryland, 21201, United States|Allina Health Cancer Institute, Minneapolis, Minnesota, 55407, United States|Saint Luke's Cancer Institute LLC, Kansas City, Missouri, 64111, United States|Summit Medical Group, Florham Park, New Jersey, 07932, United States|New Mexico Cancer Center, Albuquerque, New Mexico, 87131, United States|Weill Cornell Medicine, New York, New York, 10065, United States|University of Pittsburgh Medical Center (UPMC)/Hillman Cancer Center, Pittsburgh, Pennsylvania, 15232, United States|Texas Oncology - DFW, Dallas, Texas, 75246, United States|Texas Oncology - Houston Memorial City, Houston, Texas, 77024, United States|Texas Oncology - San Antonio Medical Center Northeast, San Antonio, Texas, 78212, United States|University of Virginia, Charlottesville, Virginia, 22903, United States|Fred Hutchinson Cancer Center / Seattle Cancer Care Alliance / University of Washington, Seattle, Washington, 98109-1023, United States|Gynakologisches Zentrum Bonn Friedensplatz, Bonn, Other, 53111, Germany|Marien Hospital Bottrop, Bottrop, Other, 46236, Germany|Stadtisches Klinikum Dessau, Dessau, Other, 06847, Germany|Universitatsklinikum Erlangen, Erlangen, Other, 91054, Germany|Kliniken Essen-Mitte - Evang. Huyssens-Stiftung, Essen, Other, 45136, Germany|Klinikum Rechts der Isar der Technischen Universitaet Muenchen, Muenchen, Other, 81675, Germany|Klinikum der Universitat Munchen, Munchen, Other, 80337, Germany|Rotkreuzklinikum Munich, Munich, Other, 80637, Germany|Pusan National University Hospital, Busan, Other, 49201, Korea, Republic of|CHA Bundang Medical Center, Seongnam, Other, 13496, Korea, Republic of|Korea Cancer Center Hospital, Seoul, Other, 01802, Korea, Republic of|Seoul National University Hospital, Seoul, Other, 03080, Korea, Republic of|Severance Hospital, Yonsei University Health System, Seoul, Other, 03722, Korea, Republic of|Samsung Medical Center, Seoul, Other, 06351, Korea, Republic of|Hospital del Mar, Barcelona, Other, 08003, Spain|Hospital Universitari Vall d'Hebron, Barcelona, Other, 08035, Spain|Complejo Hospitalario de Jaen, Jaen, Other, 23007, Spain|L'Institut Catala d'Oncologia, L'Hospitalet de Llobregat, Other, 08907, Spain|Complejo Hospitalario Universitario La Coruna, La Coruna, Other, 15006, Spain|MD Anderson Cancer Center - Madrid, Madrid, Other, 28033, Spain|Hospital Ruber Internacional, Madrid, Other, 28034, Spain|Hospital Universitario 12 de Octubre, Madrid, Other, 28041, Spain|HM Centro Integral Oncologico Clara Campal, Madrid, Other, 28050, Spain|Hospital Universitario Quironsalud Madrid, Pozuelo de Alarcon, Other, 28223, Spain"
