NCT Number,Study Title,Study URL,Acronym,Study Status,Brief Summary,Study Results,Conditions,Interventions,Primary Outcome Measures,Sponsor,Collaborators,Sex,Age,Phases,Enrollment,Funder Type,Study Type,Other IDs,Start Date,Primary Completion Date,Completion Date,First Posted,Results First Posted,Last Update Posted,Locations
NCT03720431,TTAC-0001 and Pembrolizumab Phase Ib Combination Trial in Metastatic Triple-negative Breast Cancer,https://clinicaltrials.gov/study/NCT03720431,,UNKNOWN,"This is a phase 1b, open-Label clinical trial to determine the safety and tolerability and to establish a preliminary recommended Phase 2 dose (RP2D) of TTAC-0001 administered in combination with pembrolizumab in patients with metastatic triple-negative breast cancer.",NO,Triple Negative Breast Cancer,DRUG: TTAC-0001 and pembrolizumab combination,"Dose limiting toxicities, The frequency and percentage of DLT will be presented by dose level, During the first cycle (every cycle is 21 days) of treatment|Adverse events, The frequency and percentage of AEs will be presented by dose level, From date of screening visit until the date of first documented progression or date of death from any cause, whichever came first, assessed up to 2 years|Immunogenicity, Presence anti-drug antibody (ADA) will be listed, From date of screening visit until the date of first documented progression or date of death from any cause, whichever came first, assessed up to 2 years",PharmAbcine,,ALL,"ADULT, OLDER_ADULT",PHASE1,11,INDUSTRY,INTERVENTIONAL,PMC_TTAC-0001_05,2019-01-03,2020-03-18,2022-10-26,2018-10-25,,2022-08-17,"Liverpool Hospital, Liverpool, New South Wales, 2170, Australia|Hollywood Private Hospital, Nedlands, Western Australia, 6009, Australia"
NCT04739670,"Evaluating the Efficacy and Safety of Bevacizumab, Carboplatin, Gemcitabine and Atezolizumab in Breast Cancer",https://clinicaltrials.gov/study/NCT04739670,BELLA,RECRUITING,"The study hypothesise that the combination of carboplatin, gemcitabine, bevacizumab and atezolizumab may be synergistic and improve outcomes for patients with early relapsed TNBC by overcoming mechanisms of immune resistance and thus potentiating greater and more durable responses to immune checkpoint inhibitor therapy. Early relapsing TNBC represents a high priority, unmet need whereby effective therapeutic strategies are urgently needed.",NO,Metastatic Triple Negative Breast Cancer,DRUG: Atezolizumab|DRUG: Bevacizumab|DRUG: Gemcitabine|DRUG: Carboplatin,"Progression-free survival (PFS), PFS is measured from treatment commencement to the first progression by RECIST 1.1, or death from any cause, whichever occurs first., Assessed after commencement of treatment, until the last registered patient has been followed up for 2 years.","Peter MacCallum Cancer Centre, Australia",,ALL,"ADULT, OLDER_ADULT",PHASE2,31,OTHER,INTERVENTIONAL,19/002,2021-03-01,2025-09,2025-09-30,2021-02-05,,2024-03-01,"Royal North Shore, St Leonards, New South Wales, 2065, Australia|Mater Health, South Brisbane, Queensland, 4101, Australia|Monash Health, Melbourne, Victoria, Australia|Peter MacCallum Cancer Centre, Melbourne, Victoria, Australia"
NCT06449222,"Safety and Preliminary Effectiveness of BNT327, an Investigational Therapy for Breast Cancer, When Given in Combination With Chemotherapy",https://clinicaltrials.gov/study/NCT06449222,,RECRUITING,"This study is a Phase II, multi-site, randomized, open-label clinical study to evaluate the safety, efficacy, and pharmacokinetics (PK) of BNT327 at two dose levels in combination with chemotherapeutic agents in the first- and second-line treatment of participants with locally advanced/metastatic triple-negative breast cancer (mTNBC).",NO,Locally Advanced Breast Cancer|Triple Negative Breast Cancer|Metastatic Triple Negative Breast Cancers,DRUG: BNT327 Dose Level 1 (DL1)|DRUG: BNT327 Dose Level 1 (DL2)|DRUG: Nab-placlitaxel|DRUG: Carboplatin|DRUG: Gemcitabine|DRUG: Paclitaxel|DRUG: Eribulin|DRUG: BNT327 Optimized Dose|DRUG: BNT327 Equivalent Q3W Dose,"Occurrence of treatment emergent adverse events (TEAEs), adverse events of special interest (AESIs), treatment emergent serious adverse events (SAEs), In the combination treatment regimen according to the (US) National Cancer Institute (NCI) Common Terminology Criteria for Adverse Events version 5.0 (CTCAE version 5.0). By treatment arm and overall., up to 100 days after the last dose of treatment|Occurrence of dose interruption, dose reduction, and discontinuation of study treatment due to adverse events (AEs), By treatment arm and overall., up to 100 days after the last dose of treatment|Objective Response Rate (ORR), Defined as the proportion of participants in whom a confirmed complete response (CR) or partial response (PR) (per Response Evaluation Criteria in Solid Tumors version 1.1 \[RECIST 1.1\] based on the investigator's assessment) is observed as best overall response. By treatment arm., up to 24 months after completion of study treatment of the last participant|Best percentage change from baseline in the tumor size, Based on the investigator's tumor assessment according to RECIST 1.1. Defined as the change from baseline in percent to the minimal tumor size until tumor progression/recurrence or death (whichever occurs first). By treatment arm., up to 24 months after completion of study treatment of the last participant|Proportion of participants who have achieved early tumor shrinkage, Defined as ≥10% decrease in the pretreatment sum of diameters at first post-treatment tumor scan in target lesions. By treatment arm., up to 4 months after first dose of treatment",BioNTech SE,,ALL,"ADULT, OLDER_ADULT",PHASE2,70,INDUSTRY,INTERVENTIONAL,BNT327-02,2024-08-26,2027-11,2028-09,2024-06-07,,2025-08-01,"Arizona Oncology Associates, PC, Tucson, Arizona, 85711, United States|Beverly Hills Cancer Center, Beverly Hills, California, 90211, United States|Valkyrie Clinical Trials, Los Angeles, California, 90067, United States|Stanford University School of Medicine - Stanford Cancer Institute (SCI) - Stanford Women's Cancer Center, Palo Alto, California, 94304-2201, United States|Saint John's Health Center - John Wayne Cancer Institute (JWCI), Santa Monica, California, 90404-2312, United States|Rocky Mountain Cancer Centers (RMCC), Denver, Colorado, 80220, United States|Yale University - Yale Cancer Center, New Haven, Connecticut, 06520, United States|Hematology Oncology Associates of Treasure Coast, Port Saint Lucie, Florida, 34952, United States|Kaiser Permanente - Moanalua Medical Center And Clinic, Honolulu, Hawaii, 96813, United States|Orchard Healthcare Research Inc., Skokie, Illinois, 60077, United States|Carle Foundation Hospital d/b/a Carle Cancer Center, Urbana, Illinois, 61801, United States|Northwest Cancer Centers, P.C., Dyer, Indiana, 46311, United States|Community Health Network, Indianapolis, Indiana, 46250, United States|Helen G. Nassif Community Cancer Center, Cedar Rapids, Iowa, 52403, United States|Henry Ford Hospital, Detroit, Michigan, 48202, United States|HealthPartners Regions Specialty Clinics, Saint Louis Park, Minnesota, 55426, United States|Minnesota Oncology - Woodbury Clinic, Woodbury, Minnesota, 55125, United States|Bozeman Health Deaconess Hospital Cancer Center, Bozeman, Montana, 59715, United States|Rutgers Cancer Institute of NJ (Rutgers, The State University of New Jersey), New Brunswick, New Jersey, 08901, United States|Stony Brook University Hospital, Stony Brook, New York, 11794, United States|Clinical Research Alliance Inc., Westbury, New York, 11590, United States|FirstHealth Outpatient Cancer Center, Pinehurst, North Carolina, 28374, United States|The West Clinic, P.C. d/b/a West Cancer Center, Germantown, Tennessee, 38138, United States|University of Tennessee Medical Center, Knoxville, Tennessee, 37920, United States|SCRI Oncology Partners, Nashville, Tennessee, 37203, United States|Texas Oncology - Baylor Charles A. Sammons Cancer Center, Dallas, Texas, 75246-2006, United States|Ut Health Science Center - San Antonio (UTHSCSA), Cancer Therapy & Research Center, San Antonio, Texas, 78229-4427, United States|Bon Secours St. Francis Medical Center, Midlothian, Virginia, 23114, United States|Virginia Oncology Associates, Norfolk, Virginia, 23502, United States|Northwest Cancer Specialists, Vancouver, Washington, 98684, United States|Icon Cancer Care, Wesley Clinic, Auchenflower, 4065, Australia|Peninsula Oncology Centre, Frankston, 3199, Australia|Peter MacCallum Cancer Centre, Melbourne, 3050, Australia|Mater Hospital Sydney, Sydney, 2065, Australia|Westmead Hospital, Westmead, 2145, Australia|Baskent Universitesi Tip Fakultesi Adana Hastanesi, Adana, 01120, Turkey|Medical Park Seyhan Hospital, Adana, 01230, Turkey|Adana City Training and Research Hospital, Adana, 01370, Turkey|Sakarya University - Faculty of Medicine, Adapazarı, 54290, Turkey|Gulhane Egitim ve Arastirma Hastanesi, Ankara, 06010, Turkey|Hacettepe Universitesi Kanser Enstitusu, Ankara, 06100, Turkey|Sbu Dr.A.Y. Ankara Onkoloji SUAM, Ankara, 06100, Turkey|Memorial Ankara Hospital, Ankara, 06520, Turkey|Ankara City Hospital, Ankara, 06800, Turkey|Gaziantep Sanko University Medical Faculty, Gaziantep, 36020, Turkey|Koc Universitesi Hastanesi (Koc University Hospital), Istanbul, 34010, Turkey|Bezmialem Vakif Universitesi Tip Fakultesi Hastanesi, Istanbul, 34093, Turkey|Istinye Universitesi Bahcesehir Liv Hospital, Istanbul, 34517, Turkey|Goztepe Prof. Dr. Suleyman Yalcin Sehir Hastanesi, Istanbul, 34722, Turkey|Yeditepe University Hospital, Istanbul, 34755, Turkey|Medical Point Izmir Hospital, İzmir, 35325, Turkey|Ondokuz Mayis Universitesi Tip Fakultesi, Samsun, 55139, Turkey|Acibadem Adana Hospital, Seyhan, 01130, Turkey|Gazi University Medical Faculty, Yenimahalle, 06560, Turkey|Stoke Mandeville Hospital - Buckinghamshire Healthcare NHS Trust, Aylesbury, HP21 8AL, United Kingdom|Hull and East Yorkshire Hospitals NHS Trust - Castle Hill Hospital, Cottingham, HU16 5JQ, United Kingdom|Edinburgh Cancer Centre-Western General Hospital, Edinburgh, EH4 2LF, United Kingdom|St James's University Hospital - Leeds Teaching Hospitals NHS Trust, Leeds, LS9 7TF, United Kingdom|St Bartholomew's Hospital - Barts Health NHS Trust, London, EC1A 7BE, United Kingdom|University College London Hospitals NHS Foundation Trust, London, NW2 1PG, United Kingdom|Sarah Cannon Research Institute, London, W1G 6AD, United Kingdom|Nottingham University Hospitals NHS Trust, Nottingham, NG5 1PB, United Kingdom"
NCT03055312,Bicalutamide in Treatment of Androgen Receptor (AR) Positive Metastatic Triple Negative Breast Cancer,https://clinicaltrials.gov/study/NCT03055312,SYSUCC-007,TERMINATED,"Compare the efficacy of bicalutamide with conventional chemotherapy (Treatment of Physician's Choice,TPC) in first-line treatment of AR positive metastatic triple negative breast",NO,Metastatic Triple Negative Breast Cancer,DRUG: TPC|DRUG: Bicalutamide 150 mg,"Clinical benefit rate for 16 weeks, The proportion of patients with complete response, partial response and stable disease, 16 weeks",Sun Yat-sen University,,FEMALE,"ADULT, OLDER_ADULT",PHASE3,36,OTHER,INTERVENTIONAL,SYSUCC-007,2016-12-20,2020-11-15,2020-11-15,2017-02-16,,2021-01-28,"Sun Yat-sen University Cancer Center, Guangzhou, Guangdong, 510060, China|Sun Yat-sen University, Cancer Center, Guangzhou, Guangdong, 510060, China"
NCT02834403,L-NMMA Plus Taxane Chemotherapy in Refractory Locally Advanced or Metastatic Triple Negative Breast Cancer Patients,https://clinicaltrials.gov/study/NCT02834403,,COMPLETED,"This is a Phase Ib/II study assessing the maximum tolerated dose (MTD), dose-limiting toxicities (DLTs), recommended Phase 2 dose (RP2D), and efficacy of L-NMMA when combined with docetaxel in refractory locally advanced or metastatic triple negative breast cancer patients. The Phase Ib portion of the study is designed to investigate the combination at two dose levels of docetaxel (75 and 100 mg/m2) and 7 dose levels of L-NMMA (5, 7.5, 10, 12.5, 15, 17.5, and 20 mg/kg). The starting dose of L-NMMA will be 7.5 mg/kg. In the Phase II portion of the study, the starting dose will be the RP2D determined in the Phase Ib portion of the study.",YES,Metastatic Triple Negative Breast Cancer,DRUG: L-NMMA|DRUG: Docetaxel|DRUG: Amlodipine|DRUG: Pegfilgrastim|DRUG: Enteric-coated aspirin,"Asses the Maximum Tolerated Dose (MTD) of L-NMMA When Combined With Docetaxel/Amlodipine in the Treatment of Refractory Locally Advanced or Metastatic TNBC Patients, Based on the Number of Dose Limiting Toxicities (DLTs) Per Dose Level., The Phase Ib portion of the study is designed to investigate the combination at two dose levels of docetaxel (75 and 100 mg/m2) and 7 dose levels of L-NMMA (5, 7.5, 10, 12.5, 15, 17.5, and 20 mg/kg). The starting dose will be L-NMMA at 7.5 mg/kg and docetaxel at 75 mg/m2. As patients are accrued, a standard Bayesian model averaging continual reassessment method (CRM) approach will be used to determine the appropriate dosage. For a dose level to be chosen as the MTD, at least 4 patients must have received said dose without experiencing a significant number of DLTs based on the Bayesian Model Averaging Continual Reassessment Method., DLTs assessment window is the duration required for completing one full cycle (through Day 21).|Clinical Benefit Rate, Primary Outcome Measure for Phase II: Determine the number of participants with complete response, partial response, or stable disease after 6 cycles of L-NMMA combined with taxane chemotherapy (docetaxel, paclitaxel, or nab-paclitaxel)/amlodipine, as assessed by the RECIST 1.1.

* CR (complete response) = disappearance of all target lesions
* PR (partial response) = 30% decrease in the sum of the longest diameter of target lesions
* PD (progressive disease) = 20% increase in the sum of the longest diameter of target lesions
* SD (stable disease) = small changes that do not meet above criteria
* Treatment Failure: taken off the study because of adverse events before the first restaging scan after cycle 2, The approximate length of the study from Cycle 1, Day 1 will be approximately seven months (approximately four months of treatment plus three months of follow-up).|Asses the Maximum Tolerated Dose (MTD) of Docetaxel When Combined With L-NMMA/Amlodipine in the Treatment of Refractory Locally Advanced or Metastatic TNBC Patients, Based on the Number of Dose Limiting Toxicities (DLTs) Per Dose Level., The Phase Ib portion of the study is designed to investigate the combination at two dose levels of docetaxel (75 and 100 mg/m2) and 7 dose levels of L-NMMA (5, 7.5, 10, 12.5, 15, 17.5, and 20 mg/kg). The starting dose will be L-NMMA at 7.5 mg/kg and docetaxel at 75 mg/m2. As patients are accrued, a standard Bayesian model averaging continual reassessment method (CRM) approach will be used to determine the appropriate dosage. For a dose level to be chosen as the MTD, at least 4 patients must have received said dose without experiencing a significant number of DLTs based on the Bayesian Model Averaging Continual Reassessment Method., DLTs assessment window is the duration required for completing one full cycle (through Day 21).",The Methodist Hospital Research Institute,,FEMALE,"ADULT, OLDER_ADULT",PHASE1|PHASE2,37,OTHER,INTERVENTIONAL,Pro00011685,2016-11,2021-01,2021-01,2016-07-15,2023-12-15,2023-12-15,"Houston Methodist Hospital, Houston, Texas, 77030, United States"
NCT00951054,"A Study of NK012 in Patients With Advanced, Metastatic Triple Negative Breast Cancer",https://clinicaltrials.gov/study/NCT00951054,,COMPLETED,The purpose of this study is to determine whether NK012 is safe and effective in the treatment of advanced and metastatic triple negative breast cancer.,NO,Triple Negative Breast Cancer,DRUG: NK012,"Antitumor activity (overall response rate) of NK012, At baseline and after every 2 cycles; PR or CR must be confirmed no less than 4 weeks after the first response was recorded","Nippon Kayaku Co., Ltd.",,FEMALE,"ADULT, OLDER_ADULT",PHASE2,61,INDUSTRY,INTERVENTIONAL,A6012211US,2009-02,2014-12,2015-02,2009-08-04,,2015-02-16,"Sarah Cannon Research Institute, Nashville, Tennessee, 37203, United States"
NCT04750382,A Study of HX008 for the Treatment of Patients With Metastatic Triple Negative Breast Cancer,https://clinicaltrials.gov/study/NCT04750382,,UNKNOWN,"HX008 is a humanized monoclonal antibody targeting PD-1 on T cell surface, restores T cell activity, thus enhancing immune response and has potential to treat various types of tumors. In this study, the safety and preliminary efficacy of HX008+cisplatin+gemcitabine for the treatment of patients with metastatic triple-negative breast cancer will be evaluated.",NO,Triple-negative Breast Cancer,DRUG: HX008+Cisplatin+Gemcitabine,"Number of participants with treatment-related adverse events as assessed by CTCAE v5.0, 24 months|1-year progression-free survival rate, The rate of participants who neither experience disease progression nor death, 24 months",Taizhou Hanzhong biomedical co. LTD,,ALL,"ADULT, OLDER_ADULT",PHASE1|PHASE2,31,INDUSTRY,INTERVENTIONAL,HX008-Ib/II-TNBC-01,2019-07-15,2020-12-01,2021-12-01,2021-02-11,,2021-02-11,"Fudan University Shanghai Cancer Center, Shanghai, Shanghai, China"
